Sheet: Sheet1
A1: 1 | B1: 10 | D1: 5 | E1: =RC[-1]*RC[-1] -> 25
A2: 2 | B2: 12 | D2: 6 | E2: =RC[-1]*RC[-1] -> 36
A3: 3 | B3: 14 | D3: 7 | E3: =RC[-1]*RC[-1] -> 49
A4: 4 | B4: 9 | D4: 8 | E4: =RC[-1]*RC[-1] -> 64
A5: 5 | B5: 15 | D5: 9 | E5: =RC[-1]*RC[-1] -> 81
A6: 6 | B6: 17 | D6: 10 | E6: =RC[-1]*RC[-1] -> 100