Sheet: Profile of Class
A1: The University of Chicago Graduate School of Business
A2: Employment Statistics: 2005-2006
A4: Profile of the Class of 2007
A5: 2006-09-11T00:00:00.000
A7: Class Profile for First-Year Full-Time MBA, Joint Degree, and IMBA Students
A8: Employment Profile | B8: Percent | C8: Number
B9: of Class | C9: of Students
A10: Seeking Employment | B10: =RC[1]/567 -> 0.93827160493827155 | C10: 532
A12: Not Seeking Employment | B12: =RC[1]/567 -> 6.1728395061728392E-2 | C12: 35
A13: Continuing education | B13: =RC[1]/567 -> 3.3509700176366841E-2 | C13: 19
A14: Self employed/founding business | B14: =RC[1]/567 -> 1.2345679012345678E-2 | C14: 7
A15: Sponsored student | B15: =RC[1]/567 -> 1.0582010582010581E-2 | C15: 6
A16: Postponing job search | B16: =RC[1]/567 -> 1.7636684303350969E-3 | C16: 1
A17: Other Reasons | B17: =RC[1]/567 -> 3.5273368606701938E-3 | C17: 2
A19: Not Responding to Survey | B19: =RC[1]/567 -> 0 | C19: 0
A21: First-Year Students | B21: =RC[1]/567 -> 1 | C21: 567
A23: Job Offers(1)
A24: U.S. Citizens/Permanent Residents | B24: 0.99399999999999999
A25: Foreign Nationals | B25: 1
A26: Total | B26: 0.996
A29: Job Acceptances(1)
A30: U.S. Citizens/Permanent Residents | B30: 0.99399999999999999
A31: Foreign Nationals | B31: 1
A32: Total | B32: 0.996
A35: Demographic Profile(2)
A36: Mean Age | B36: 28
A37: Mean Years of Work Experience | B37: 5
A38: Female | B38: 0.28000000000000003
A39: International | B39: 0.32
A40: Married | B40: 0.24
A41: (1) Represents percent of students who are seeking employment.
A42: (2) Demographic information is based on full-time MBA students matriculating
A43: in September 2005.
A54: kdflsqkdfskjfmlskjflm jkjlmk | C54: qsdfmlksjlmdfk

Sheet: Hires by Function
A1: The University of Chicago Graduate School of Business
A2: Employment Statistics - 2005-2006
A4: New Hires by Function - Intern
A5: 2006-09-11T00:00:00.000
A6: Function | B6: Percent | C6: Number | D6: Minimum | E6: Maximum | F6: Median
B7: of Hires | C7: of Hires(1) | D7: Monthly | E7: Monthly | F7: Monthly
D8: Salary(2) | E8: Salary(2) | F8: Salary(2)
A9: Business Development | B9: =RC[1]/543 -> 2.3941068139963169E-2 | C9: 13 | D9: 2300 | E9: 8300 | F9: 5600
A10: Consulting | B10: =RC[1]/543 -> 0.16390423572744015 | C10: 89 | D10: 1000 | E10: 12800 | F10: 9500
A11: Finance | B11: =RC[1]/543 -> 0.5948434622467772 | C11: =SUM(R[1]C:R[7]C) -> 323 | D11: 900 | E11: 13900 | F11: 7916
A12: Finance - Company Finance (Analysis/Treasury) | B12: =RC[1]/543 -> 9.0239410681399637E-2 | C12: 49 | D12: 2400 | E12: 8400 | F12: 6000
A13: Finance - Investment Banking | B13: =RC[1]/543 -> 0.21731123388581952 | C13: 118 | D13: 900 | E13: 10000 | F13: 7917
A14: Finance - Investment Management/Research | B14: =RC[1]/543 -> 0.11786372007366483 | C14: 64 | D14: 1000 | E14: 13235 | F14: 7917
A15: Finance - Private Client Services | B15: =RC[1]/543 -> 1.1049723756906077E-2 | C15: 6 | D15: 7300 | E15: 8000 | F15: 7900
A16: Finance - Real Estate | B16: =RC[1]/543 -> 7.3664825046040518E-3 | C16: 4 | D16: Insufficient(2)
A17: Finance - Sales and Trading | B17: =RC[1]/543 -> 9.0239410681399637E-2 | C17: 49 | D17: 5000 | E17: 13900 | F17: 7917
A18: Finance - Venture Capital/Private Equity | B18: =RC[1]/543 -> 6.0773480662983423E-2 | C18: 33 | D18: 1000 | E18: 9000 | F18: 4500
A19: General Management | B19: =RC[1]/543 -> 4.6040515653775323E-2 | C19: 25 | D19: 3200 | E19: 7500 | F19: 6055
A20: Human Resources | B20: =RC[1]/543 -> 7.3664825046040518E-3 | C20: 4 | D20: Insufficient(2)
A21: Information Systems - Management | B21: =RC[1]/543 -> 7.3664825046040518E-3 | C21: 4 | D21: Insufficient(2)
A22: Marketing | B22: =RC[1]/543 -> 0.10128913443830571 | C22: =SUM(R[1]C:R[3]C) -> 55 | D22: 1300 | E22: 7916 | F22: 5600
A23: Marketing - Advertising/Communications | B23: =RC[1]/543 -> 1.1049723756906077E-2 | C23: 6 | D23: 2000 | E23: 7000 | F23: 5887.5
A24: Marketing - Brand/Product Management | B24: =RC[1]/543 -> 7.18232044198895E-2 | C24: 39 | D24: 1300 | E24: 7916 | F24: 5600
A25: Marketing - Research | B25: =RC[1]/543 -> 1.841620626151013E-2 | C25: 10 | D25: 2600 | E25: 7550 | F25: 5300
A26: Strategic Planning | B26: =RC[1]/543 -> 4.7882136279926338E-2 | C26: 26 | D26: 1000 | E26: 12000 | F26: 5400
A27: Other | B27: =RC[1]/543 -> 7.3664825046040518E-3 | C27: 4 | D27: Insufficient(2)
A28: Total | B28: 1 | C28: 543 | D28: 900 | E28: 13900 | F28: 7600
A29: (1) Eleven students in the Class of 2007 reported having two internships; one student had three internships.
A30: (2) Compensation information is self-reported. Insufficient data indicates less than 1% reporting for all accepted offers.
A31: (3) Bonus information: 24% of accepted offers reported in the consulting function received a sign-on bonus, for which the
A32: median bonus was $5,000.

Sheet: Top Six Functions
A1: The University of Chicago Graduate School of Business
A2: Employment Statistics: 2005-2006
A4: Top Six Functions - Intern
A5: 2006-09-11T00:00:00.000
A6: Function | B6: Percent of Hires | C6: Number of Hires(1)
A7: Top Six Functions | B7: =RC[1]/543 -> 0.78084714548802947 | C7: =SUM(R[1]C:R[6]C) -> 424
A8: Finance - Investment Banking | B8: 0.217 | C8: 118
A9: Consulting | B9: 0.16400000000000001 | C9: 89
A10: Finance - Investment Management/ Research | B10: 0.11799999999999999 | C10: 64
A11: Marketing | B11: 0.10100000000000001 | C11: 55
A12: Finance - Company Finance (Analysis/ Treasury) | B12: 0.09 | C12: 49
A13: Finance - Sales and Trading | B13: 0.09 | C13: 49
A14: All Others | B14: 0.219 | C14: 119
A15: Total | B15: =R[-8]C+R[-1]C -> 0.99984714548802944 | C15: =R[-8]C+R[-1]C -> 543
A16: (1) Eleven students in the Class of 2007 reported having 2 internships; one student had 3 internships.

Sheet: Hires by Industry
A1: The University of Chicago Graduate School of Business
A2: Employment Statistics: 2005-2006
A4: New Hires by Industry - Intern
A5: 2006-09-11T00:00:00.000
A6: Industry | B6: Percent | C6: Number | D6: Minimum | E6: Maximum | F6: Median
B7: of Hires | C7: of Hires(1) | D7: Monthly | E7: Monthly | F7: Monthly
D8: Salary(2) | E8: Salary(2) | F8: Salary(2)
A9: Consulting | B9: =RC[1]/543 -> 0.1694290976058932 | C9: 92 | D9: 4333 | E9: 12800 | F9: 9500
A10: Consumer Packaged Goods | B10: =RC[1]/543 -> 5.5248618784530384E-2 | C10: 30 | D10: 4400 | E10: 7500 | F10: 5650
A11: Entertainment/Leisure | B11: =RC[1]/543 -> 9.2081031307550652E-3 | C11: 5 | D11: Insufficient(2)
A12: Financial Services | B12: =RC[1]/543 -> 0.53038674033149169 | C12: 288 | D12: 900 | E12: 13900 | F12: 7916
A13: Financial Services - Commercial Banking | B13: =RC[1]/543 -> 1.289134438305709E-2 | C13: 7 | D13: 2500 | E13: 7916 | F13: 6500
A14: Financial Services - Diversified Financial Services | B14: =RC[1]/543 -> 6.8139963167587483E-2 | C14: 37 | D14: 2000 | E14: 8000 | F14: 7200
A15: Financial Services - Insurance | B15: =RC[1]/543 -> 3.6832412523020259E-3 | C15: 2 | D15: Insufficient(2)
A16: Financial Services - Investment Banking/Brokerage | B16: =RC[1]/543 -> 0.2983425414364641 | C16: 162 | D16: 1000 | E16: 13900 | F16: 7917
A17: Financial Services - Investment Management | B17: =RC[1]/543 -> 9.5764272559852676E-2 | C17: 52 | D17: 1000 | E17: 13235 | F17: 7796
A18: Financial Services - Venture Capital/Private Equity | B18: =RC[1]/543 -> 5.1565377532228361E-2 | C18: 28 | D18: 900 | E18: 8500 | F18: 4800
A19: Government/Nonprofit | B19: =RC[1]/543 -> 1.1049723756906077E-2 | C19: 6 | D19: 2300 | E19: 4400 | F19: 3040
A20: Manufacturing | B20: =RC[1]/543 -> 3.4990791896869246E-2 | C20: 19 | D20: 1583 | E20: 10000 | F20: 6000
A21: Petroleum/Energy | B21: =RC[1]/543 -> 2.3941068139963169E-2 | C21: 13 | D21: 1300 | E21: 7550 | F21: 6000
A22: Pharmaceutical/Biotechnology/Healthcare Services | B22: =RC[1]/543 -> 3.3149171270718231E-2 | C22: 18 | D22: 5200 | E22: 7550 | F22: 6675
A23: Retail | B23: =RC[1]/543 -> 1.4732965009208104E-2 | C23: 8 | D23: 2500 | E23: 6000 | F23: 5470
A24: Technology | B24: =RC[1]/543 -> 7.3664825046040522E-2 | C24: 40 | D24: 1400 | E24: 8400 | F24: 5716.5
A25: Computer-Related Services | B25: =RC[1]/543 -> 1.289134438305709E-2 | C25: 7 | D25: 2000 | E25: 7083 | F25: 6000
A26: E-Commerce and Internet | B26: =RC[1]/543 -> 1.1049723756906077E-2 | C26: 6 | D26: 4000 | E26: 8300 | F26: 6650
A27: Electronic Equipment | B27: =RC[1]/543 -> 3.4990791896869246E-2 | C27: 19 | D27: 1400 | E27: 8400 | F27: 5600
A28: Software/Printing/Publishing | B28: =RC[1]/543 -> 9.2081031307550652E-3 | C28: 5 | D28: Insufficient(2)
A29: Telecommunications | B29: =RC[1]/543 -> 5.5248618784530384E-3 | C29: 3 | D29: Insufficient(2)
A30: Transportation Services/Equipment | B30: =RC[1]/543 -> 1.1049723756906077E-2 | C30: 6 | D30: 4850 | E30: 12000 | F30: 5945.5
A31: Other | B31: =RC[1]/543 -> 3.3149171270718231E-2 | C31: 18 | D31: 1000 | E31: 10400 | F31: 4700
A32: Total | B32: 1 | C32: 543 | D32: 900 | E32: 13900 | F32: 7600
A33: (1) Eleven students in the Class of 2007 reported having two internships; one student had three internships.
A34: (2) Compensation information is self-reported. Insufficient data indicates less than 1% reporting for all accepted offers.
A35: (3) Bonus information: 23% of accepted offers reported in the consulting industry received a sign-on bonus, for which the
A36: median bonus was $5,000.

Sheet: Top Five Industries
A1: The University of Chicago Graduate School of Business
A2: Employment Statistics: 2005-2006
A4: Top Five Industries - Intern
A5: 2006-09-11T00:00:00.000
A6: Industry | B6: Percent of Hires | C6: Number of Hires(1)
A7: Top Five Industries | B7: =SUM(R[1]C:R[5]C) -> 0.70499999999999985 | C7: =SUM(R[1]C:R[5]C) -> 383
A8: Financial Services - Investment Banking/Brokerage | B8: 0.29799999999999999 | C8: 162
A9: Consulting | B9: 0.16900000000000001 | C9: 92
A10: Financial Services - Investment Management | B10: 9.6000000000000002E-2 | C10: 52
A11: Technology | B11: 7.3999999999999996E-2 | C11: 40
A12: Financial Services - Diversified Financial Services | B12: 6.8000000000000005E-2 | C12: 37
A13: All Others | B13: 0.29499999999999998 | C13: 160
A14: Total | B14: =R[-7]C+R[-1]C -> 0.99999999999999978 | C14: =R[-7]C+R[-1]C -> 543
A15: (1) Eleven students in the Class of 2007 reported having 2 internships; one student had 3 internships.

Sheet: Hires by Location
A1: The University of Chicago Graduate School of Business
A2: Employment Statistics: 2005-2006
A4: New Hires by Location - Intern
A5: 2006-09-11T00:00:00.000
A6: Region | B6: Percent | C6: Number | D6: Median
B7: of Hires | C7: of Hires(1) | D7: Monthly
D8: Salary(2)
A9: United States | B9: =RC[1]/543 -> 0.78084714548802947 | C9: 424 | D9: 7550
A11: Midwest | B11: =RC[1]/543 -> 0.36095764272559855 | C11: 196 | D11: 6021
A12: Chicago | B12: =RC[1]/543 -> 0.2965009208103131 | C12: 161 | D12: 6000
A13: Minneapolis | B13: =RC[1]/543 -> 1.841620626151013E-2 | C13: 10 | D13: 6460
A15: Northeast | B15: =RC[1]/543 -> 0.27440147329650094 | C15: 149 | D15: 7917
A16: New York City | B16: =RC[1]/543 -> 0.24125230202578268 | C16: 131 | D16: 7917
A17: Boston | B17: =RC[1]/543 -> 3.1307550644567222E-2 | C17: 17 | D17: 7500
A19: West | B19: =RC[1]/543 -> 9.5764272559852676E-2 | C19: 52 | D19: 7000
A20: San Francisco | B20: =RC[1]/543 -> 4.6040515653775323E-2 | C20: 25 | D20: 7550
A21: Los Angeles | B21: =RC[1]/543 -> 2.7624309392265192E-2 | C21: 15 | D21: 7600
A23: Southwest | B23: =RC[1]/543 -> 1.841620626151013E-2 | C23: 10 | D23: 9500
A24: Dallas | B24: =RC[1]/543 -> 1.1049723756906077E-2 | C24: 6 | D24: 9500
A26: Mid-Atlantic | B26: =RC[1]/543 -> 1.6574585635359115E-2 | C26: 9 | D26: 7346
A28: South | B28: =RC[1]/543 -> 1.4732965009208104E-2 | C28: 8 | D28: 6750
A30: International | B30: =RC[1]/543 -> 0.21915285451197053 | C30: =SUM(R[2]C+R[7]C+R[10]C+R[12]C+R[14]C) -> 119 | D30: 7916
A32: Asia | B32: =RC[1]/543 -> 0.10865561694290976 | C32: 59 | D32: 7916
A33: Hong Kong | B33: =RC[1]/543 -> 3.3149171270718231E-2 | C33: 18 | D33: 7918.5
A34: Tokyo | B34: =RC[1]/543 -> 2.5782688766114181E-2 | C34: 14 | D34: 7500
A35: Seoul | B35: =RC[1]/543 -> 2.0257826887661142E-2 | C35: 11 | D35: 8800
A37: Europe | B37: =RC[1]/543 -> 9.2081031307550645E-2 | C37: 50 | D37: 8355
A38: London | B38: =RC[1]/543 -> 7.7348066298342538E-2 | C38: 42 | D38: 8372
A40: Latin America and the Caribbean | B40: =RC[1]/543 -> 1.4732965009208104E-2 | C40: 8 | D40: 5300
A42: Africa | B42: =RC[1]/543 -> 1.841620626151013E-3 | C42: 1 | D42: Insufficient(2)
A44: North America | B44: =RC[1]/543 -> 1.841620626151013E-3 | C44: 1 | D44: Insufficient(2)
A46: TOTAL | B46: =R[-37]C+R[-16]C -> 1 | C46: =R[-37]C+R[-16]C -> 543 | D46: 7600
A47: (1) Eleven students in the Class of 2007 reported having 2 internships; one student had 3 internships.
A48: (2) Compensation information is self-reported. Insufficient data indicates less than 1% reporting for all accepted offers.

Sheet: Job Source
A1: The University of Chicago Graduate School of Business
A2: Employment Statistics: 2005-2006
A4: New Hires by Job Source - Intern
A5: 2006-09-11T00:00:00.000
A7: Method of Hire | B7: Percent | C7: Number
B8: Of Hires | C8: Of Hires(1)
A9: School Facilitated | B9: =RC[1]/R[14]C[1] -> 0.93186003683241247 | C9: =SUM(R[1]C:R[7]C) -> 506
A10: Interview on campus - invite schedule | B10: =RC[1]/543 -> 0.48066298342541436 | C10: 261
A11: Interview on campus - open schedule | B11: =RC[1]/543 -> 0.13627992633517497 | C11: 74
A12: Other GSB source (e.g., faculty/staff/student groups) | B12: =RC[1]/543 -> 0.11233885819521179 | C12: 61
A13: Off-campus interview sourced through the GSB | B13: =RC[1]/543 -> 0.10497237569060773 | C13: 57
A14: Job Postings/Resume Referral Service | B14: =RC[1]/543 -> 6.6298342541436461E-2 | C14: 36
A15: Alumni contact | B15: =RC[1]/543 -> 1.841620626151013E-2 | C15: 10
A16: School-sponsored career fair | B16: =RC[1]/543 -> 1.289134438305709E-2 | C16: 7
A18: Direct Contact with Company (2) | B18: =RC[1]/R[5]C[1] -> 6.8139963167587483E-2 | C18: =SUM(R[1]C:R[3]C) -> 37
A19: Prior business contact | B19: =RC[1]/543 -> 3.1307550644567222E-2 | C19: 17
A20: Personal/family contact | B20: =RC[1]/543 -> 2.0257826887661142E-2 | C20: 11
A21: Letter campaign | B21: =RC[1]/543 -> 1.6574585635359115E-2 | C21: 9
A23: Total | B23: =R[-5]C+R[-14]C -> 1 | C23: =R[-14]C+R[-5]C -> 543
A24: (1) Eleven students in the Class of 2007 reported having two internships; one student had three internships.