Sheet: Sheet1
A1: =0 -> 0 | B1: =0 -> 0 | C1: =0 -> 1899-12-31T00:00:00.000 | D1: =0 -> 0 | E1: =0 -> 0
A2: Department | B2: IT | I2: =0 -> 0
A3: Chief
A4: Name | B4: Age | C4: Birth date | D4: Payment | E4: Bonus | F4: Total
A5: Derek | B5: 35 years | C5: 1971-01-02T23:42:38.026 | D5: 3000 | E5: 0.3 | F5: =RC[-2]*(1+RC[-1]) -> 3900
A7: Employees
A8: Name | B8: Age | C8: Birth Date | D8: Payment | E8: Bonus | F8: Total | G8: Superior Name | H8: Superior Payment
A9: Elsa | B9: 28 years | C9: 1980-03-15T23:42:38.026 | D9: 1500 | E9: 0.15 | F9: =RC[-2]*(1+RC[-1]) -> 1724.9999999999998
A10: Oleg | B10: 32 years | C10: 1976-08-20T23:42:38.026 | D10: 2300 | E10: 0.25 | F10: =RC[-2]*(1+RC[-1]) -> 2875 | G10: John | H10: 2800
A11: Neil | B11: 34 years | C11: 1968-06-06T23:42:38.026 | D11: 2500 | E11: 0 | F11: =RC[-2]*(1+RC[-1]) -> 2500 | G11: John | H11: 2800
A12: Maria | B12: 34 years | C12: 1978-09-17T23:42:38.026 | D12: 1700 | E12: 0.15 | F12: =RC[-2]*(1+RC[-1]) -> 1954.9999999999998 | G12: Oleg | H12: 2300
A13: John | B13: 35 years | C13: 1980-03-15T23:42:38.026 | D13: 2800 | E13: 0.2 | F13: =RC[-2]*(1+RC[-1]) -> 3360
A14: Employee Payment Totals: | D14: =SUM(R[-5]C:R[-1]C) -> 10800 | F14: =SUM(R[-5]C:R[-1]C) -> 12415 | H14: =SUM(R[-5]C:R[-1]C) -> 7900
A16: Total payment: | F16: =R[-11]C+R[-2]C -> 16315