Sheet: ZZZfirstsheet
A1: description | B1: entered | C1: calculated
A2: empty string | C2: ="" -> 
A3: len near 128 | B3: xxxxxxxxxxxxxxxxxxxxxxxxxxxxxxxxxxxxxxxxxxxxxxxxxxxxxxxxxxxxxxxxxxxxxxxxxxxxxxxxxxxxxxxxxxxxxxxxxxxxxxxxxxxxxxxxxxxxxxxxxxxxxxx | C3: =REPT("x",RC[1]) -> xxxxxxxxxxxxxxxxxxxxxxxxxxxxxxxxxxxxxxxxxxxxxxxxxxxxxxxxxxxxxxxxxxxxxxxxxxxxxxxxxxxxxxxxxxxxxxxxxxxxxxxxxxxxxxxxxxxxxxxxxxxxxxx | D3: 127
A4: len near 128 | B4: xxxxxxxxxxxxxxxxxxxxxxxxxxxxxxxxxxxxxxxxxxxxxxxxxxxxxxxxxxxxxxxxxxxxxxxxxxxxxxxxxxxxxxxxxxxxxxxxxxxxxxxxxxxxxxxxxxxxxxxxxxxxxxxx | C4: =REPT("x",RC[1]) -> xxxxxxxxxxxxxxxxxxxxxxxxxxxxxxxxxxxxxxxxxxxxxxxxxxxxxxxxxxxxxxxxxxxxxxxxxxxxxxxxxxxxxxxxxxxxxxxxxxxxxxxxxxxxxxxxxxxxxxxxxxxxxxxx | D4: 128
A5: len near 128 | B5: xxxxxxxxxxxxxxxxxxxxxxxxxxxxxxxxxxxxxxxxxxxxxxxxxxxxxxxxxxxxxxxxxxxxxxxxxxxxxxxxxxxxxxxxxxxxxxxxxxxxxxxxxxxxxxxxxxxxxxxxxxxxxxxxx | C5: =REPT("x",RC[1]) -> xxxxxxxxxxxxxxxxxxxxxxxxxxxxxxxxxxxxxxxxxxxxxxxxxxxxxxxxxxxxxxxxxxxxxxxxxxxxxxxxxxxxxxxxxxxxxxxxxxxxxxxxxxxxxxxxxxxxxxxxxxxxxxxxx | D5: 129
A6: non-ascii | B6: √ê | C6: =CHAR(13*16) -> ‚Äì
A7: zero | B7: 0 | C7: =1-1 -> 0
A8: one | B8: 1 | C8: =2-1 -> 1
A9: minus 1 | B9: -1 | C9: =0-1 -> -1
A10: 1.23 | B10: 1.23 | C10: =1+0.23 -> 1.23
A11: 1.234 | B11: 1.234 | C11: =1+0.234 -> 1.234
A12: 123456 | B12: 123456 | C12: =123456 -> 123456
A13: 1.23456789012345 | B13: 1.23456789012345 | C13: =RC[-1]+1 -> 2.2345678901234498
A14: one third | B14: 0.33333333333333298 | C14: =1/3 -> 0.33333333333333331
A15: true | B15: 1 | C15: =TRUE -> 1
A16: false | B16: 0 | C16: =FALSE -> 0
A17: #div/0! | B17: #DIV/0! | C17: =1/0 -> #DIV/0!
A18: #na | B18: #N/A | C18: =NA() -> #N/A
A19: #name? | B19: #NAME? | C19: =sqr(-1) -> #NAME?
A20: #num! | B20: #NUM! | C20: =SQRT(-1) -> #NUM!
A21: #value! | B21: #VALUE! | C21: =1+R[-20]C[-2]:R[-11]C[-1] -> #VALUE!
A22: #ref! | B22: #REF! | C22: =SUM(#REF!) -> #REF!
A23: #null! | B23: #NULL! | C23: =SUM(RC[2]:RC[3] RC[4]:RC[5]) -> #NULL!
A24: no data (formatting) | D24: more guff
A25: rich text 1 | B25: boldplain | C25: =RC[-1]&RC[-1] -> boldplainboldplain
A26: rich text 2 | B26: ArialCourier | C26: =RC[-1]&RC[-1] -> ArialCourierArialCourier
A27: no data (no formatting) | D27: filler
A28: Short Date | B28: 1999-12-31T00:00:00.000 | C28: =RC[-1]+1 -> 2000-01-01T00:00:00.000
A29: dd-mmm | B29: 2008-01-18T00:00:00.000 | C29: =RC[-1]+1 -> 2008-01-19T00:00:00.000
A30: dd/mm/yy | B30: 2008-01-18T00:00:00.000 | C30: =RC[-1]+1 -> 2008-01-19T00:00:00.000
A31: dd/mm/yyyy | B31: 2008-01-18T00:00:00.000 | C31: =RC[-1]+1 -> 2008-01-19T00:00:00.000
A32: Long Date | B32: 2008-01-18T00:00:00.000 | C32: =RC[-1]+1 -> 2008-01-19T00:00:00.000
A33: Hard newline (Alt-Enter) | B33: Line1 Line2 Line3 | C33: ="Line1"&CHAR(10)&"Line2"&CHAR(10)&"Line3" -> Line1 Line2 Line3
A34: NBSP | B34: foonly frabjous farnarklingliness
A35: 2 internal spaces | B35: foo bar | C35: ="foo "&" bar" -> foo bar
A36: 1 leading space | B36: foo | C36: =" "&"foo" -> foo
A37: 2 leading spaces | B37: foo | C37: ="  "&"foo" -> foo
A38: 1 trailing space | B38: foo | C38: ="foo"&" " -> foo
A39: 2 trailing spaces | B39: foo | C39: ="foo"&"  " -> foo
A40: Hard newline (Alt-Enter) | B40: Line1 Line2 | C40: ="Line1"&CHAR(10)&"Line2" -> Line1 Line2
A41: Hard newline (Alt-Enter) with leading trailing & internal spaces | B41: Li ne1 Li ne2 Li ne3
A42: embedded control chars | C42: =CHAR(9)&CHAR(10)&CHAR(12)&CHAR(13) -> 
A43: embedded CC with u/score | C43: =CHAR(9)&CHAR(10)&CHAR(12)&CHAR(13)&"P_xQ_x000F_R_x000C_S" -> P_xQ_x000F_R_x000C_S
A44: currency | B44: 1234.56 | C44: 1234.56
A45: time | B45: =1/11 -> 1899-12-31T02:10:54.545 | C45: =1/11 -> 1899-12-31T02:10:54.545
A46: more underscores | B46: _x000F__x000f_ | C46: ="_x000F__x000f_" -> _x000F__x000f_
A47: less/greater/ampersand | B47: 1 2 4 3 | C47: ="1 < 2" & " & 4 > 3" -> 1 2 4 3
A48: rich text and spaces | B48: x bold y
A49: spaces in font name | B49: this is Times New Roman
A50: empty cells | D50: guff
A51: datetime | B51: 2009-07-06T02:10:54.545 | C51: =RC[-1]+1 -> 2009-07-07T02:10:54.545
A52: pseudofloat inf | B52: 123E999 | C52: ="123E999" -> 123E999
A53: pseudofloat big | B53: 12E99 | C53: ="12E99" -> 12E99
A54: pseudofloat tiny | B54: 12E-99 | C54: ="12E-99" -> 12E-99
A55: text with custom date format | B55: text, dammit | C55: ="text, dammit" -> text, dammit
A56: text with standard date format | B56: text, dammit | C56: ="text, dammit" -> text, dammit

Sheet: AAA2ndsheet
A1: 2nd sheet
A2: not mrgd | B2: nm | C2: nm | D2: nm | E2: nm
A3: nm | B3: merged cells can be quite a barrel of fun | E3: nm
A4: nm | E4: nm
A5: nm | B5: nm | C5: nm | D5: nm | E5: nm
A6: Merged all the cells in two rows -- what html appears for the 2nd row?
A8: a8 | B8: b8 | C8: c8 | D8: d8 | E8: e8

Sheet: ControlChars
A1: 1 | C1: =CHAR(RC[-2]) -> 
A2: 2 | C2: =CHAR(RC[-2]) -> 
A3: 3 | C3: =CHAR(RC[-2]) -> 
A4: 4 | C4: =CHAR(RC[-2]) -> 
A5: 5 | C5: =CHAR(RC[-2]) -> 
A6: 6 | C6: =CHAR(RC[-2]) -> 
A7: 7 | C7: =CHAR(RC[-2]) -> 
A8: 8 | C8: =CHAR(RC[-2]) -> 
A9: 9 | C9: =CHAR(RC[-2]) -> 
A10: 10 | C10: =CHAR(RC[-2]) -> 
A11: 11 | C11: =CHAR(RC[-2]) -> 
A12: 12 | C12: =CHAR(RC[-2]) -> 
A13: 13 | C13: =CHAR(RC[-2]) -> 
A14: 14 | C14: =CHAR(RC[-2]) -> 
A15: 15 | C15: =CHAR(RC[-2]) -> 
A16: 16 | C16: =CHAR(RC[-2]) -> 
A17: 17 | C17: =CHAR(RC[-2]) -> 
A18: 18 | C18: =CHAR(RC[-2]) -> 
A19: 19 | C19: =CHAR(RC[-2]) -> 
A20: 20 | C20: =CHAR(RC[-2]) -> 
A21: 21 | C21: =CHAR(RC[-2]) -> 
A22: 22 | C22: =CHAR(RC[-2]) -> 
A23: 23 | C23: =CHAR(RC[-2]) -> 
A24: 24 | C24: =CHAR(RC[-2]) -> 
A25: 25 | C25: =CHAR(RC[-2]) -> 
A26: 26 | C26: =CHAR(RC[-2]) -> 
A27: 27 | C27: =CHAR(RC[-2]) -> 
A28: 28 | C28: =CHAR(RC[-2]) -> 
A29: 29 | C29: =CHAR(RC[-2]) -> 
A30: 30 | C30: =CHAR(RC[-2]) -> 
A31: 31 | C31: =CHAR(RC[-2]) -> 
A32: 32 | C32: =CHAR(RC[-2]) -> 