Sheet: PROFILEDEF
A1: PROFIL | B1: a | C1: b | D1: c | E1: d | F1: e | G1: f | H1: g | I1: h | J1: i | K1: j | L1: k | M1: l
A2: P8.2 | B2: 100 | C2: 101 | D2: 102 | E2: 103 | F2: 104 | G2: 105 | H2: 106 | I2: 107 | J2: 108 | K2: 109 | L2: 110 | M2: 111
A3: P8.3 | B3: 112 | C3: 113 | D3: 114 | E3: 115 | F3: 116 | G3: 117 | H3: 118 | I3: 119 | J3: 120 | K3: 121 | L3: 122 | M3: 123
A4: P8.4 | B4: 124 | C4: 125 | D4: 126 | E4: 127 | F4: 128 | G4: 129 | H4: 130 | I4: 131 | J4: 132 | K4: 133 | L4: 134 | M4: 135
A5: P8.5 | B5: 136 | C5: 137 | D5: 138 | E5: 139 | F5: 140 | G5: 141 | H5: 142 | I5: 143 | J5: 144 | K5: 145 | L5: 146 | M5: 147
A6: P8.6 | B6: 148 | C6: 149 | D6: 150 | E6: 151 | F6: 152 | G6: 153 | H6: 154 | I6: 155 | J6: 156 | K6: 157 | L6: 158 | M6: 159
A7: P8.7 | B7: 160 | C7: 161 | D7: 162 | E7: 163 | F7: 164 | G7: 165 | H7: 166 | I7: 167 | J7: 168 | K7: 169 | L7: 170 | M7: 171
A8: P9 | B8: 172 | C8: 173 | D8: 174 | E8: 175 | F8: 176 | G8: 177 | H8: 178 | I8: 179 | J8: 180 | K8: 181 | L8: 182 | M8: 183
A9: P9.1 | B9: 184 | C9: 185 | D9: 186 | E9: 187 | F9: 188 | G9: 189 | H9: 190 | I9: 191 | J9: 192 | K9: 193 | L9: 194 | M9: 195
A10: P9.2 | B10: 196 | C10: 197 | D10: 198 | E10: 199 | F10: 200 | G10: 201 | H10: 202 | I10: 203 | J10: 204 | K10: 205 | L10: 206 | M10: 207
A11: P9.3 | B11: 208 | C11: 209 | D11: 210 | E11: 211 | F11: 212 | G11: 213 | H11: 214 | I11: 215 | J11: 216 | K11: 217 | L11: 218 | M11: 219
A12: P9.4 | B12: 220 | C12: 221 | D12: 222 | E12: 223 | F12: 224 | G12: 225 | H12: 226 | I12: 227 | J12: 228 | K12: 229 | L12: 230 | M12: 231
A13: P9.5 | B13: 232 | C13: 233 | D13: 234 | E13: 235 | F13: 236 | G13: 237 | H13: 238 | I13: 239 | J13: 240 | K13: 241 | L13: 242 | M13: 243
A14: P9.6 | B14: 244 | C14: 245 | D14: 246 | E14: 247 | F14: 248 | G14: 249 | H14: 250 | I14: 251 | J14: 252 | K14: 253 | L14: 254 | M14: 255
A15: Q0 | B15: 256 | C15: 257 | D15: 258 | E15: 259 | F15: 260 | G15: 261 | H15: 262 | I15: 263 | J15: 264 | K15: 265 | L15: 266 | M15: 267

Sheet: AXISDEF
A1: PROFIL | B1: i | C1: d
A2: P8.2 | B2: 1 | C2: 100
A3: P8.3 | B3: 2 | C3: 101
A4: P8.4 | B4: 3 | C4: 102
A5: P8.5 | B5: 4 | C5: 103
A6: P8.6 | B6: 5 | C6: 104
A7: P8.7 | B7: 6 | C7: 105
A8: P9 | B8: 7 | C8: 106
A9: P9.1 | B9: 8 | C9: 107
A10: P9.2 | B10: 9 | C10: 108
A11: P9.3 | B11: 10 | C11: 109
A12: P9.4 | B12: 11 | C12: 110
A13: P9.5 | B13: 12 | C13: 111
A14: P9.6 | B14: 13 | C14: 112
A15: Q0 | B15: 14 | C15: 113

Sheet: TRAVERSALCHAINAGE
B1: a | C1: b | D1: c | E1: d | F1: e | G1: f | H1: g | I1: h | J1: i | K1: j | L1: k | M1: l
A2: P8.2 | B2: 0 | C2: 0.20000999999999181 | D2: 1.100040000000007 | E2: 2.425139999999999 | F2: 3.3499999999999943 | G2: 3.5999999999999943 | H2: 3.9000000000000057 | I2: 4.9000000000000057 | J2: 8.1500000000000057 | K2: 12.400000000000006 | L2: 13.300000000000011 | M2: 13.5
A3: P8.3 | B3: 0 | C3: 0.20000999999999181 | D3: 1.100040000000007 | E3: 2.425139999999999 | F3: 3.3499999999999943 | G3: 3.5999999999999943 | H3: 3.9000000000000057 | I3: 4.9000000000000057 | J3: 8.1500000000000057 | K3: 12.400000000000006 | L3: 13.300000000000011 | M3: 13.5
A4: P8.4 | B4: 0 | C4: 0.20000999999999181 | D4: 1.100040000000007 | E4: 2.42514000101025 | F4: 3.3500000007313382 | G4: 3.5999999999999943 | H4: 3.9000000000000057 | I4: 4.9000000000000057 | J4: 8.1500000000000057 | K4: 12.400000000000006 | L4: 13.300000000000011 | M4: 13.5
A5: P8.5 | B5: 0 | C5: 0.20000999999999181 | D5: 1.100040000000007 | E5: 2.425139999999999 | F5: 3.3499999999999943 | G5: 3.5999999999999943 | H5: 3.9000000000000057 | I5: 4.9000000000000057 | J5: 8.1500000000000057 | K5: 12.400000000000006 | L5: 13.300000000000011 | M5: 13.5
A6: P8.6 | B6: 0 | C6: 0.20000999999999181 | D6: 1.100040000000007 | E6: 2.425139999999999 | F6: 3.3499999999999943 | G6: 3.5999999999999943 | H6: 3.9000000000000057 | I6: 4.9000000000000057 | J6: 8.1500000000000057 | K6: 12.400000000000006 | L6: 13.300000000000011 | M6: 13.5
A7: P8.7 | B7: 0 | C7: 0.20000999999999181 | D7: 1.100040000000007 | E7: 2.425139999999999 | F7: 3.3499999999999943 | G7: 3.5999999999999943 | H7: 3.9000000000000057 | I7: 4.9000000000000057 | J7: 8.1500000000000057 | K7: 12.400000000000006 | L7: 13.300000000000011 | M7: 13.5
A8: P9 | B8: 0 | C8: 0.20000999999999181 | D8: 1.100040000000007 | E8: 2.425139999999999 | F8: 3.3499999999999943 | G8: 3.5999999999999943 | H8: 3.9000000000000057 | I8: 4.9000000000000057 | J8: 8.1500000003006203 | K8: 12.400000000000006 | L8: 13.300000000000011 | M8: 13.5
A9: P9.1 | B9: 0 | C9: 0.20000999999999181 | D9: 1.100040000000007 | E9: 2.425139999999999 | F9: 3.3499999999999943 | G9: 3.5999999999999943 | H9: 3.9000000000000057 | I9: 4.9000000000000057 | J9: 8.1500000000000057 | K9: 12.400000000000006 | L9: 13.300000000000011 | M9: 13.5
A10: P9.2 | B10: 0 | C10: 0.20000999999999181 | D10: 1.100040000000007 | E10: 2.425139999999999 | F10: 3.3499999999999943 | G10: 3.5999999999999943 | H10: 3.9000000000000057 | I10: 4.9000000000000057 | J10: 8.1500000000000057 | K10: 12.400000000000006 | L10: 13.300000000000011 | M10: 13.5
A11: P9.3 | B11: 0 | C11: 0.20015000624532372 | D11: 1.1000100436814177 | E11: 2.4225101011347601 | F11: 3.3499201404361845 | G11: 3.5999201502255547 | H11: 3.8999201608238172 | I11: 4.900110202862801 | J11: 8.1501103387991147 | K11: 12.399920516793657 | L11: 13.299920554349201 | M11: 13.499920563336664
A12: P9.4 | B12: 0 | C12: 0.20079199037810921 | D12: 1.1001710396570099 | E12: 2.4210031256691837 | F12: 3.3502817118564949 | G12: 3.6000063616193736 | H12: 3.9000977329421009 | I12: 4.9002183837559814 | J12: 8.1502041587987275 | K12: 12.400102344807491 | L12: 13.300103280260645 | M12: 13.500104585302307
A13: P9.5 | B13: 0 | C13: 0.20016938552138316 | D13: 1.0999812914772777 | E13: 2.4362844524398213 | F13: 3.349981288365671 | G13: 3.6000078869358321 | H13: 3.9000019237046568 | I13: 4.9012189863339337 | J13: 8.1512154156358854 | K13: 12.432409581106954 | L13: 13.33301173977584 | M13: 13.533151135696396
A14: P9.6 | B14: 0 | C14: 0.20031937125501814 | D14: 1.0997542889664147 | E14: 2.4441815539153389 | F14: 3.3500144749836593 | G14: 3.600033287873881 | H14: 3.9000316965122361 | I14: 4.9009883401718017 | J14: 8.1509832065831276 | K14: 12.574170651637441 | L14: 13.477430779139622 | M14: 13.678180613988845
A15: Q0 | B15: 0 | C15: 0.20001398851080079 | D15: 0.90001545125623894 | E15: 2.2260099698339078 | F15: 3.1522656205973587 | G15: 3.4022543732207793 | H15: 3.7022661698208523 | I15: 4.7023890913130506 | J15: 7.9523861479495377 | K15: 12.576304655903488 | L15: 13.482609224182093 | M15: 13.684058218470865

Sheet: AXISDATUMLEVELS
B1: i | C1: d
A2: P8.2 | B2: 265.21206000000001 | C2: 266.80038999999999
A3: P8.3 | B3: 265.19956000000002 | C3: 266.78789
A4: P8.4 | B4: 265.18706000000003 | C4: 266.77539000000002
A5: P8.5 | B5: 265.17456000000004 | C5: 266.76289000000003
A6: P8.6 | B6: 265.16206 | C6: 266.75038999999998
A7: P8.7 | B7: 265.1497 | C7: 266.73788999999999
A8: P9 | B8: 265.14870999999999 | C8: 266.75344999999999
A9: P9.1 | B9: 265.16855000000004 | C9: 266.80345
A10: P9.2 | B10: 265.20921000000004 | C10: 266.85345000000001
A11: P9.3 | B11: 265.27082000000001 | C11: 266.90348
A12: P9.4 | B12: 265.35327000000001 | C12: 266.96953000000002
A13: P9.5 | B13: 265.45660000000004 | C13: 267.12488999999999
A14: P9.6 | B14: 265.58080000000001 | C14: 267.28262000000001
A15: Q0 | B15: 265.71045000000004 | C15: 267.42773

Sheet: PROFILELEVELS
A1: PROFIL | B1: Quergef√§lle | C1: i1 | D1: h3 | E1: h2 | F1: h1 | G1: a1 | H1: a2 | I1: b1 | J1: c1 | K1: f1 | L1: g1 | M1: l1 | N1: l2 | O1: j1 | P1: k1 | Q1: j3 | R1: j4 | S1: g3 | T1: g4 | U1: d1 | V1: c3 | W1: e1 | X1: f3 | Y1: f2 | Z1: g2 | AA1: b2 | AB1: c2 | AC1: j2 | AD1: k2
A2: P8.2 | B2: 2.5000000000000001E-2 | C2: =AXISDATUMLEVELS!RC[-1]:R[13]C[-1] -> 265.21206000000001 | D2: =RC[-1]-RC[-2]*(TRAVERSALCHAINAGE!RC[6]-TRAVERSALCHAINAGE!RC[5]) -> 265.13081 | E2: =RC[-1]-0.14 -> 264.99081000000001 | F2: =RC[-1]-1 -> 263.99081000000001 | G2: =RC[-1]+RC[-5]*TRAVERSALCHAINAGE!RC[2] -> 264.11331000000001 | H2: =RC[-1]+0.985 -> 265.09831000000003 | I2: =RC[-4]+RC[-7]*(TRAVERSALCHAINAGE!RC-TRAVERSALCHAINAGE!RC[-6]) -> 265.10830974999999 | J2: =RC[-5]+RC[-8]*(TRAVERSALCHAINAGE!RC[-1]-TRAVERSALCHAINAGE!RC[-6]) -> 265.08580899999998 | K2: =RC[-6]+RC[-9]*(TRAVERSALCHAINAGE!RC[-2]-TRAVERSALCHAINAGE!RC[-4]) -> 265.02331000000004 | L2: =RC[-7]+RC[-10]*(TRAVERSALCHAINAGE!RC[-3]-TRAVERSALCHAINAGE!RC[-4]) -> 265.01580999999999 | M2: =RC[-7]+RC[-11]*(TRAVERSALCHAINAGE!RC-TRAVERSALCHAINAGE!RC[-4]) -> 264.20580999999999 | N2: =RC[-1]+0.985 -> 265.19081 | O2: =RC[-10]+RC[-13]*(TRAVERSALCHAINAGE!RC[-4]-TRAVERSALCHAINAGE!RC[-6]) -> 265.17831000000001 | P2: =RC[-11]+RC[-14]*(TRAVERSALCHAINAGE!RC[-4]-TRAVERSALCHAINAGE!RC[-7]) -> 265.20080999999999 | Q2: =RC[-2]+0.14 -> 265.31831 | R2: =RC[-3]+0.284 -> 265.46231 | S2: =RC[-7]+0.14 -> 265.15580999999997 | T2: =RC[-16]+0.178 -> 265.30880999999999 | U2: =AXISDATUMLEVELS!RC[-18] -> 266.80038999999999 | V2: =RC[-1]+0.025*(TRAVERSALCHAINAGE!RC[-17]-TRAVERSALCHAINAGE!RC[-18]) -> 266.83351749999997 | W2: =RC[-2]-0.025*(TRAVERSALCHAINAGE!RC[-17]-TRAVERSALCHAINAGE!RC[-18]) -> 266.77726849999999 | X2: =RC[-1]+0.00625 -> 266.78351850000001 | Y2: =RC[-1]+0.2 -> 266.9835185 | Z2: =RC[-1] -> 266.9835185 | AA2: 270.64999999999998 | AB2: 270.64999999999998 | AC2: 270.64999999999998 | AD2: 270.64999999999998
A3: P8.3 | B3: 2.5000000000000001E-2 | C3: =AXISDATUMLEVELS!RC[-1]:R[13]C[-1] -> 265.19956000000002 | D3: =RC[-1]-RC[-2]*(TRAVERSALCHAINAGE!RC[6]-TRAVERSALCHAINAGE!RC[5]) -> 265.11831000000001 | E3: =RC[-1]-0.14 -> 264.97831000000002 | F3: =RC[-1]-1 -> 263.97831000000002 | G3: =RC[-1]+RC[-5]*TRAVERSALCHAINAGE!RC[2] -> 264.10081000000002 | H3: =RC[-1]+0.985 -> 265.08581000000004 | I3: =RC[-4]+RC[-7]*(TRAVERSALCHAINAGE!RC-TRAVERSALCHAINAGE!RC[-6]) -> 265.09580975 | J3: =RC[-5]+RC[-8]*(TRAVERSALCHAINAGE!RC[-1]-TRAVERSALCHAINAGE!RC[-6]) -> 265.07330899999999 | K3: =RC[-6]+RC[-9]*(TRAVERSALCHAINAGE!RC[-2]-TRAVERSALCHAINAGE!RC[-4]) -> 265.01081000000005 | L3: =RC[-7]+RC[-10]*(TRAVERSALCHAINAGE!RC[-3]-TRAVERSALCHAINAGE!RC[-4]) -> 265.00331 | M3: =RC[-7]+RC[-11]*(TRAVERSALCHAINAGE!RC-TRAVERSALCHAINAGE!RC[-4]) -> 264.19331 | N3: =RC[-1]+0.985 -> 265.17831000000001 | O3: =RC[-10]+RC[-13]*(TRAVERSALCHAINAGE!RC[-4]-TRAVERSALCHAINAGE!RC[-6]) -> 265.16581000000002 | P3: =RC[-11]+RC[-14]*(TRAVERSALCHAINAGE!RC[-4]-TRAVERSALCHAINAGE!RC[-7]) -> 265.18831 | Q3: =RC[-2]+0.14 -> 265.30581000000001 | R3: =RC[-3]+0.284 -> 265.44981000000001 | S3: =RC[-7]+0.14 -> 265.14330999999999 | T3: =RC[-16]+0.178 -> 265.29631000000001 | U3: =AXISDATUMLEVELS!RC[-18] -> 266.78789 | V3: =RC[-1]+0.025*(TRAVERSALCHAINAGE!RC[-17]-TRAVERSALCHAINAGE!RC[-18]) -> 266.82101749999998 | W3: =RC[-2]-0.025*(TRAVERSALCHAINAGE!RC[-17]-TRAVERSALCHAINAGE!RC[-18]) -> 266.7647685 | X3: =RC[-1]+0.00625 -> 266.77101850000003 | Y3: =RC[-1]+0.2 -> 266.97101850000001 | Z3: =RC[-1] -> 266.97101850000001 | AA3: 270.64999999999998 | AB3: 270.64999999999998 | AC3: 270.64999999999998 | AD3: 270.64999999999998
A4: P8.4 | B4: 2.5000000000000001E-2 | C4: =AXISDATUMLEVELS!RC[-1]:R[13]C[-1] -> 265.18706000000003 | D4: =RC[-1]-RC[-2]*(TRAVERSALCHAINAGE!RC[6]-TRAVERSALCHAINAGE!RC[5]) -> 265.10581000000002 | E4: =RC[-1]-0.14 -> 264.96581000000003 | F4: =RC[-1]-1 -> 263.96581000000003 | G4: =RC[-1]+RC[-5]*TRAVERSALCHAINAGE!RC[2] -> 264.08831000000004 | H4: =RC[-1]+0.985 -> 265.07331000000005 | I4: =RC[-4]+RC[-7]*(TRAVERSALCHAINAGE!RC-TRAVERSALCHAINAGE!RC[-6]) -> 265.08330975000001 | J4: =RC[-5]+RC[-8]*(TRAVERSALCHAINAGE!RC[-1]-TRAVERSALCHAINAGE!RC[-6]) -> 265.06080900000001 | K4: =RC[-6]+RC[-9]*(TRAVERSALCHAINAGE!RC[-2]-TRAVERSALCHAINAGE!RC[-4]) -> 264.99831000000006 | L4: =RC[-7]+RC[-10]*(TRAVERSALCHAINAGE!RC[-3]-TRAVERSALCHAINAGE!RC[-4]) -> 264.99081000000001 | M4: =RC[-7]+RC[-11]*(TRAVERSALCHAINAGE!RC-TRAVERSALCHAINAGE!RC[-4]) -> 264.18081000000001 | N4: =RC[-1]+0.985 -> 265.16581000000002 | O4: =RC[-10]+RC[-13]*(TRAVERSALCHAINAGE!RC[-4]-TRAVERSALCHAINAGE!RC[-6]) -> 265.15331000000003 | P4: =RC[-11]+RC[-14]*(TRAVERSALCHAINAGE!RC[-4]-TRAVERSALCHAINAGE!RC[-7]) -> 265.17581000000001 | Q4: =RC[-2]+0.14 -> 265.29331000000002 | R4: =RC[-3]+0.284 -> 265.43731000000002 | S4: =RC[-7]+0.14 -> 265.13081 | T4: =RC[-16]+0.178 -> 265.28381000000002 | U4: =AXISDATUMLEVELS!RC[-18] -> 266.77539000000002 | V4: =RC[-1]+0.025*(TRAVERSALCHAINAGE!RC[-17]-TRAVERSALCHAINAGE!RC[-18]) -> 266.80851750002529 | W4: =RC[-2]-0.025*(TRAVERSALCHAINAGE!RC[-17]-TRAVERSALCHAINAGE!RC[-18]) -> 266.75226850000701 | X4: =RC[-1]+0.00625 -> 266.75851850000703 | Y4: =RC[-1]+0.2 -> 266.95851850000702 | Z4: =RC[-1] -> 266.95851850000702 | AA4: 270.64999999999998 | AB4: 270.64999999999998 | AC4: 270.64999999999998 | AD4: 270.64999999999998
A5: P8.5 | B5: 2.5000000000000001E-2 | C5: =AXISDATUMLEVELS!RC[-1]:R[13]C[-1] -> 265.17456000000004 | D5: =RC[-1]-RC[-2]*(TRAVERSALCHAINAGE!RC[6]-TRAVERSALCHAINAGE!RC[5]) -> 265.09331000000003 | E5: =RC[-1]-0.14 -> 264.95331000000004 | F5: =RC[-1]-1 -> 263.95331000000004 | G5: =RC[-1]+RC[-5]*TRAVERSALCHAINAGE!RC[2] -> 264.07581000000005 | H5: =RC[-1]+0.985 -> 265.06081000000006 | I5: =RC[-4]+RC[-7]*(TRAVERSALCHAINAGE!RC-TRAVERSALCHAINAGE!RC[-6]) -> 265.07080975000002 | J5: =RC[-5]+RC[-8]*(TRAVERSALCHAINAGE!RC[-1]-TRAVERSALCHAINAGE!RC[-6]) -> 265.04830900000002 | K5: =RC[-6]+RC[-9]*(TRAVERSALCHAINAGE!RC[-2]-TRAVERSALCHAINAGE!RC[-4]) -> 264.98581000000007 | L5: =RC[-7]+RC[-10]*(TRAVERSALCHAINAGE!RC[-3]-TRAVERSALCHAINAGE!RC[-4]) -> 264.97831000000002 | M5: =RC[-7]+RC[-11]*(TRAVERSALCHAINAGE!RC-TRAVERSALCHAINAGE!RC[-4]) -> 264.16831000000002 | N5: =RC[-1]+0.985 -> 265.15331000000003 | O5: =RC[-10]+RC[-13]*(TRAVERSALCHAINAGE!RC[-4]-TRAVERSALCHAINAGE!RC[-6]) -> 265.14081000000004 | P5: =RC[-11]+RC[-14]*(TRAVERSALCHAINAGE!RC[-4]-TRAVERSALCHAINAGE!RC[-7]) -> 265.16331000000002 | Q5: =RC[-2]+0.14 -> 265.28081000000003 | R5: =RC[-3]+0.284 -> 265.42481000000004 | S5: =RC[-7]+0.14 -> 265.11831000000001 | T5: =RC[-16]+0.178 -> 265.27131000000003 | U5: =AXISDATUMLEVELS!RC[-18] -> 266.76289000000003 | V5: =RC[-1]+0.025*(TRAVERSALCHAINAGE!RC[-17]-TRAVERSALCHAINAGE!RC[-18]) -> 266.7960175 | W5: =RC[-2]-0.025*(TRAVERSALCHAINAGE!RC[-17]-TRAVERSALCHAINAGE!RC[-18]) -> 266.73976850000003 | X5: =RC[-1]+0.00625 -> 266.74601850000005 | Y5: =RC[-1]+0.2 -> 266.94601850000004 | Z5: =RC[-1] -> 266.94601850000004 | AA5: 270.64999999999998 | AB5: 270.64999999999998 | AC5: 270.64999999999998 | AD5: 270.64999999999998
A6: P8.6 | B6: 2.5000000000000001E-2 | C6: =AXISDATUMLEVELS!RC[-1]:R[13]C[-1] -> 265.16206 | D6: =RC[-1]-RC[-2]*(TRAVERSALCHAINAGE!RC[6]-TRAVERSALCHAINAGE!RC[5]) -> 265.08080999999999 | E6: =RC[-1]-0.14 -> 264.94081 | F6: =RC[-1]-1 -> 263.94081 | G6: =RC[-1]+RC[-5]*TRAVERSALCHAINAGE!RC[2] -> 264.06331 | H6: =RC[-1]+0.985 -> 265.04831000000001 | I6: =RC[-4]+RC[-7]*(TRAVERSALCHAINAGE!RC-TRAVERSALCHAINAGE!RC[-6]) -> 265.05830974999998 | J6: =RC[-5]+RC[-8]*(TRAVERSALCHAINAGE!RC[-1]-TRAVERSALCHAINAGE!RC[-6]) -> 265.03580899999997 | K6: =RC[-6]+RC[-9]*(TRAVERSALCHAINAGE!RC[-2]-TRAVERSALCHAINAGE!RC[-4]) -> 264.97331000000003 | L6: =RC[-7]+RC[-10]*(TRAVERSALCHAINAGE!RC[-3]-TRAVERSALCHAINAGE!RC[-4]) -> 264.96580999999998 | M6: =RC[-7]+RC[-11]*(TRAVERSALCHAINAGE!RC-TRAVERSALCHAINAGE!RC[-4]) -> 264.15580999999997 | N6: =RC[-1]+0.985 -> 265.14080999999999 | O6: =RC[-10]+RC[-13]*(TRAVERSALCHAINAGE!RC[-4]-TRAVERSALCHAINAGE!RC[-6]) -> 265.12831 | P6: =RC[-11]+RC[-14]*(TRAVERSALCHAINAGE!RC[-4]-TRAVERSALCHAINAGE!RC[-7]) -> 265.15080999999998 | Q6: =RC[-2]+0.14 -> 265.26830999999999 | R6: =RC[-3]+0.284 -> 265.41230999999999 | S6: =RC[-7]+0.14 -> 265.10580999999996 | T6: =RC[-16]+0.178 -> 265.25880999999998 | U6: =AXISDATUMLEVELS!RC[-18] -> 266.75038999999998 | V6: =RC[-1]+0.025*(TRAVERSALCHAINAGE!RC[-17]-TRAVERSALCHAINAGE!RC[-18]) -> 266.78351749999996 | W6: =RC[-2]-0.025*(TRAVERSALCHAINAGE!RC[-17]-TRAVERSALCHAINAGE!RC[-18]) -> 266.72726849999998 | X6: =RC[-1]+0.00625 -> 266.7335185 | Y6: =RC[-1]+0.2 -> 266.93351849999999 | Z6: =RC[-1] -> 266.93351849999999 | AA6: 270.64999999999998 | AB6: 270.64999999999998 | AC6: 270.64999999999998 | AD6: 270.64999999999998
A7: P8.7 | B7: 2.5000000000000001E-2 | C7: =AXISDATUMLEVELS!RC[-1]:R[13]C[-1] -> 265.1497 | D7: =RC[-1]-RC[-2]*(TRAVERSALCHAINAGE!RC[6]-TRAVERSALCHAINAGE!RC[5]) -> 265.06844999999998 | E7: =RC[-1]-0.14 -> 264.92845 | F7: =RC[-1]-1 -> 263.92845 | G7: =RC[-1]+RC[-5]*TRAVERSALCHAINAGE!RC[2] -> 264.05095 | H7: =RC[-1]+0.985 -> 265.03595000000001 | I7: =RC[-4]+RC[-7]*(TRAVERSALCHAINAGE!RC-TRAVERSALCHAINAGE!RC[-6]) -> 265.04594974999998 | J7: =RC[-5]+RC[-8]*(TRAVERSALCHAINAGE!RC[-1]-TRAVERSALCHAINAGE!RC[-6]) -> 265.02344899999997 | K7: =RC[-6]+RC[-9]*(TRAVERSALCHAINAGE!RC[-2]-TRAVERSALCHAINAGE!RC[-4]) -> 264.96095000000003 | L7: =RC[-7]+RC[-10]*(TRAVERSALCHAINAGE!RC[-3]-TRAVERSALCHAINAGE!RC[-4]) -> 264.95344999999998 | M7: =RC[-7]+RC[-11]*(TRAVERSALCHAINAGE!RC-TRAVERSALCHAINAGE!RC[-4]) -> 264.14344999999997 | N7: =RC[-1]+0.985 -> 265.12844999999999 | O7: =RC[-10]+RC[-13]*(TRAVERSALCHAINAGE!RC[-4]-TRAVERSALCHAINAGE!RC[-6]) -> 265.11595 | P7: =RC[-11]+RC[-14]*(TRAVERSALCHAINAGE!RC[-4]-TRAVERSALCHAINAGE!RC[-7]) -> 265.13844999999998 | Q7: =RC[-2]+0.14 -> 265.25594999999998 | R7: =RC[-3]+0.284 -> 265.39994999999999 | S7: =RC[-7]+0.14 -> 265.09344999999996 | T7: =RC[-16]+0.178 -> 265.24644999999998 | U7: =AXISDATUMLEVELS!RC[-18] -> 266.73788999999999 | V7: =RC[-1]+0.025*(TRAVERSALCHAINAGE!RC[-17]-TRAVERSALCHAINAGE!RC[-18]) -> 266.77101749999997 | W7: =RC[-2]-0.025*(TRAVERSALCHAINAGE!RC[-17]-TRAVERSALCHAINAGE!RC[-18]) -> 266.71476849999999 | X7: =RC[-1]+0.00625 -> 266.72101850000001 | Y7: =RC[-1]+0.2 -> 266.9210185 | Z7: =RC[-1] -> 266.9210185 | AA7: 270.64999999999998 | AB7: 270.64999999999998 | AC7: 270.64999999999998 | AD7: 270.64999999999998
A8: P9 | B8: 2.5000000000000001E-2 | C8: =AXISDATUMLEVELS!RC[-1]:R[13]C[-1] -> 265.14870999999999 | D8: =RC[-1]-RC[-2]*(TRAVERSALCHAINAGE!RC[6]-TRAVERSALCHAINAGE!RC[5]) -> 265.06745999999248 | E8: =RC[-1]-0.14 -> 264.92745999999249 | F8: =RC[-1]-1 -> 263.92745999999249 | G8: =RC[-1]+RC[-5]*TRAVERSALCHAINAGE!RC[2] -> 264.0499599999925 | H8: =RC[-1]+0.985 -> 265.03495999999251 | I8: =RC[-4]+RC[-7]*(TRAVERSALCHAINAGE!RC-TRAVERSALCHAINAGE!RC[-6]) -> 265.04495974999247 | J8: =RC[-5]+RC[-8]*(TRAVERSALCHAINAGE!RC[-1]-TRAVERSALCHAINAGE!RC[-6]) -> 265.02245899999247 | K8: =RC[-6]+RC[-9]*(TRAVERSALCHAINAGE!RC[-2]-TRAVERSALCHAINAGE!RC[-4]) -> 264.95995999999252 | L8: =RC[-7]+RC[-10]*(TRAVERSALCHAINAGE!RC[-3]-TRAVERSALCHAINAGE!RC[-4]) -> 264.95245999999247 | M8: =RC[-7]+RC[-11]*(TRAVERSALCHAINAGE!RC-TRAVERSALCHAINAGE!RC[-4]) -> 264.14245999999247 | N8: =RC[-1]+0.985 -> 265.12745999999248 | O8: =RC[-10]+RC[-13]*(TRAVERSALCHAINAGE!RC[-4]-TRAVERSALCHAINAGE!RC[-6]) -> 265.11495999999249 | P8: =RC[-11]+RC[-14]*(TRAVERSALCHAINAGE!RC[-4]-TRAVERSALCHAINAGE!RC[-7]) -> 265.13745999999247 | Q8: =RC[-2]+0.14 -> 265.25495999999248 | R8: =RC[-3]+0.284 -> 265.39895999999248 | S8: =RC[-7]+0.14 -> 265.09245999999246 | T8: =RC[-16]+0.178 -> 265.24545999999248 | U8: =AXISDATUMLEVELS!RC[-18] -> 266.75344999999999 | V8: =RC[-1]+0.025*(TRAVERSALCHAINAGE!RC[-17]-TRAVERSALCHAINAGE!RC[-18]) -> 266.78657749999996 | W8: =RC[-2]-0.025*(TRAVERSALCHAINAGE!RC[-17]-TRAVERSALCHAINAGE!RC[-18]) -> 266.73032849999998 | X8: =RC[-1]+0.00625 -> 266.73657850000001 | Y8: =RC[-1]+0.2 -> 266.9365785 | Z8: =RC[-1] -> 266.9365785 | AA8: 270.64999999999998 | AB8: 270.64999999999998 | AC8: 270.64999999999998 | AD8: 270.64999999999998
A9: P9.1 | B9: 2.5000000000000001E-2 | C9: =AXISDATUMLEVELS!RC[-1]:R[13]C[-1] -> 265.16855000000004 | D9: =RC[-1]-RC[-2]*(TRAVERSALCHAINAGE!RC[6]-TRAVERSALCHAINAGE!RC[5]) -> 265.08730000000003 | E9: =RC[-1]-0.14 -> 264.94730000000004 | F9: =RC[-1]-1 -> 263.94730000000004 | G9: =RC[-1]+RC[-5]*TRAVERSALCHAINAGE!RC[2] -> 264.06980000000004 | H9: =RC[-1]+0.985 -> 265.05480000000006 | I9: =RC[-4]+RC[-7]*(TRAVERSALCHAINAGE!RC-TRAVERSALCHAINAGE!RC[-6]) -> 265.06479975000002 | J9: =RC[-5]+RC[-8]*(TRAVERSALCHAINAGE!RC[-1]-TRAVERSALCHAINAGE!RC[-6]) -> 265.04229900000001 | K9: =RC[-6]+RC[-9]*(TRAVERSALCHAINAGE!RC[-2]-TRAVERSALCHAINAGE!RC[-4]) -> 264.97980000000007 | L9: =RC[-7]+RC[-10]*(TRAVERSALCHAINAGE!RC[-3]-TRAVERSALCHAINAGE!RC[-4]) -> 264.97230000000002 | M9: =RC[-7]+RC[-11]*(TRAVERSALCHAINAGE!RC-TRAVERSALCHAINAGE!RC[-4]) -> 264.16230000000002 | N9: =RC[-1]+0.985 -> 265.14730000000003 | O9: =RC[-10]+RC[-13]*(TRAVERSALCHAINAGE!RC[-4]-TRAVERSALCHAINAGE!RC[-6]) -> 265.13480000000004 | P9: =RC[-11]+RC[-14]*(TRAVERSALCHAINAGE!RC[-4]-TRAVERSALCHAINAGE!RC[-7]) -> 265.15730000000002 | Q9: =RC[-2]+0.14 -> 265.27480000000003 | R9: =RC[-3]+0.284 -> 265.41880000000003 | S9: =RC[-7]+0.14 -> 265.1123 | T9: =RC[-16]+0.178 -> 265.26530000000002 | U9: =AXISDATUMLEVELS!RC[-18] -> 266.80345 | V9: =RC[-1]+0.025*(TRAVERSALCHAINAGE!RC[-17]-TRAVERSALCHAINAGE!RC[-18]) -> 266.83657749999998 | W9: =RC[-2]-0.025*(TRAVERSALCHAINAGE!RC[-17]-TRAVERSALCHAINAGE!RC[-18]) -> 266.7803285 | X9: =RC[-1]+0.00625 -> 266.78657850000002 | Y9: =RC[-1]+0.2 -> 266.98657850000001 | Z9: =RC[-1] -> 266.98657850000001 | AA9: 270.64999999999998 | AB9: 270.64999999999998 | AC9: 270.64999999999998 | AD9: 270.64999999999998
A10: P9.2 | B10: 2.5000000000000001E-2 | C10: =AXISDATUMLEVELS!RC[-1]:R[13]C[-1] -> 265.20921000000004 | D10: =RC[-1]-RC[-2]*(TRAVERSALCHAINAGE!RC[6]-TRAVERSALCHAINAGE!RC[5]) -> 265.12796000000003 | E10: =RC[-1]-0.14 -> 264.98796000000004 | F10: =RC[-1]-1 -> 263.98796000000004 | G10: =RC[-1]+RC[-5]*TRAVERSALCHAINAGE!RC[2] -> 264.11046000000005 | H10: =RC[-1]+0.985 -> 265.09546000000006 | I10: =RC[-4]+RC[-7]*(TRAVERSALCHAINAGE!RC-TRAVERSALCHAINAGE!RC[-6]) -> 265.10545975000002 | J10: =RC[-5]+RC[-8]*(TRAVERSALCHAINAGE!RC[-1]-TRAVERSALCHAINAGE!RC[-6]) -> 265.08295900000002 | K10: =RC[-6]+RC[-9]*(TRAVERSALCHAINAGE!RC[-2]-TRAVERSALCHAINAGE!RC[-4]) -> 265.02046000000007 | L10: =RC[-7]+RC[-10]*(TRAVERSALCHAINAGE!RC[-3]-TRAVERSALCHAINAGE!RC[-4]) -> 265.01296000000002 | M10: =RC[-7]+RC[-11]*(TRAVERSALCHAINAGE!RC-TRAVERSALCHAINAGE!RC[-4]) -> 264.20296000000002 | N10: =RC[-1]+0.985 -> 265.18796000000003 | O10: =RC[-10]+RC[-13]*(TRAVERSALCHAINAGE!RC[-4]-TRAVERSALCHAINAGE!RC[-6]) -> 265.17546000000004 | P10: =RC[-11]+RC[-14]*(TRAVERSALCHAINAGE!RC[-4]-TRAVERSALCHAINAGE!RC[-7]) -> 265.19796000000002 | Q10: =RC[-2]+0.14 -> 265.31546000000003 | R10: =RC[-3]+0.284 -> 265.45946000000004 | S10: =RC[-7]+0.14 -> 265.15296000000001 | T10: =RC[-16]+0.178 -> 265.30596000000003 | U10: =AXISDATUMLEVELS!RC[-18] -> 266.85345000000001 | V10: =RC[-1]+0.025*(TRAVERSALCHAINAGE!RC[-17]-TRAVERSALCHAINAGE!RC[-18]) -> 266.88657749999999 | W10: =RC[-2]-0.025*(TRAVERSALCHAINAGE!RC[-17]-TRAVERSALCHAINAGE!RC[-18]) -> 266.83032850000001 | X10: =RC[-1]+0.00625 -> 266.83657850000003 | Y10: =RC[-1]+0.2 -> 267.03657850000002 | Z10: =RC[-1] -> 267.03657850000002 | AA10: 270.64999999999998 | AB10: 270.64999999999998 | AC10: 270.64999999999998 | AD10: 270.64999999999998
A11: P9.3 | B11: 2.3399E-2 | C11: =AXISDATUMLEVELS!RC[-1]:R[13]C[-1] -> 265.27082000000001 | D11: =RC[-1]-RC[-2]*(TRAVERSALCHAINAGE!RC[6]-TRAVERSALCHAINAGE!RC[5]) -> 265.19477324681924 | E11: =RC[-1]-0.14 -> 265.05477324681925 | F11: =RC[-1]-1 -> 264.05477324681925 | G11: =RC[-1]+RC[-5]*TRAVERSALCHAINAGE!RC[2] -> 264.16943092545603 | H11: =RC[-1]+0.985 -> 265.15443092545604 | I11: =RC[-4]+RC[-7]*(TRAVERSALCHAINAGE!RC-TRAVERSALCHAINAGE!RC[-6]) -> 265.16474761545993 | J11: =RC[-5]+RC[-8]*(TRAVERSALCHAINAGE!RC[-1]-TRAVERSALCHAINAGE!RC[-6]) -> 265.14369179044394 | K11: =RC[-6]+RC[-9]*(TRAVERSALCHAINAGE!RC[-2]-TRAVERSALCHAINAGE!RC[-4]) -> 265.08519639386088 | L11: =RC[-7]+RC[-10]*(TRAVERSALCHAINAGE!RC[-3]-TRAVERSALCHAINAGE!RC[-4]) -> 265.07817669361293 | M11: =RC[-7]+RC[-11]*(TRAVERSALCHAINAGE!RC-TRAVERSALCHAINAGE!RC[-4]) -> 264.25600020944398 | N11: =RC[-1]+0.985 -> 265.241000209444 | O11: =RC[-10]+RC[-13]*(TRAVERSALCHAINAGE!RC[-4]-TRAVERSALCHAINAGE!RC[-6]) -> 265.2302613083549 | P11: =RC[-11]+RC[-14]*(TRAVERSALCHAINAGE!RC[-4]-TRAVERSALCHAINAGE!RC[-7]) -> 265.2513204092337 | Q11: =RC[-2]+0.14 -> 265.37026130835488 | R11: =RC[-3]+0.284 -> 265.51426130835489 | S11: =RC[-7]+0.14 -> 265.21817669361292 | T11: =RC[-16]+0.178 -> 265.37277324681924 | U11: =AXISDATUMLEVELS!RC[-18] -> 266.90348 | V11: =RC[-1]+0.025*(TRAVERSALCHAINAGE!RC[-17]-TRAVERSALCHAINAGE!RC[-18]) -> 266.93654250143635 | W11: =RC[-2]-0.025*(TRAVERSALCHAINAGE!RC[-17]-TRAVERSALCHAINAGE!RC[-18]) -> 266.88029474901748 | X11: =RC[-1]+0.00625 -> 266.8865447490175 | Y11: =RC[-1]+0.2 -> 267.08654474901749 | Z11: =RC[-1] -> 267.08654474901749 | AA11: 270.64999999999998 | AB11: 270.64999999999998 | AC11: 270.64999999999998 | AD11: 270.64999999999998
A12: P9.4 | B12: 1.7399000000000001E-2 | C12: =AXISDATUMLEVELS!RC[-1]:R[13]C[-1] -> 265.35327000000001 | D12: =RC[-1]-RC[-2]*(TRAVERSALCHAINAGE!RC[6]-TRAVERSALCHAINAGE!RC[5]) -> 265.29672349750007 | E12: =RC[-1]-0.14 -> 265.15672349750008 | F12: =RC[-1]-1 -> 264.15672349750008 | G12: =RC[-1]+RC[-5]*TRAVERSALCHAINAGE!RC[2] -> 264.24198239715906 | H12: =RC[-1]+0.985 -> 265.22698239715908 | I12: =RC[-4]+RC[-7]*(TRAVERSALCHAINAGE!RC-TRAVERSALCHAINAGE!RC[-6]) -> 265.23848881731845 | J12: =RC[-5]+RC[-8]*(TRAVERSALCHAINAGE!RC[-1]-TRAVERSALCHAINAGE!RC[-6]) -> 265.22284052124007 | K12: =RC[-6]+RC[-9]*(TRAVERSALCHAINAGE!RC[-2]-TRAVERSALCHAINAGE!RC[-4]) -> 265.17934588647324 | L12: =RC[-7]+RC[-10]*(TRAVERSALCHAINAGE!RC[-3]-TRAVERSALCHAINAGE!RC[-4]) -> 265.17412459670356 | M12: =RC[-7]+RC[-11]*(TRAVERSALCHAINAGE!RC-TRAVERSALCHAINAGE!RC[-4]) -> 264.30635291752077 | N12: =RC[-1]+0.985 -> 265.29135291752078 | O12: =RC[-10]+RC[-13]*(TRAVERSALCHAINAGE!RC[-4]-TRAVERSALCHAINAGE!RC[-6]) -> 265.28721397853843 | P12: =RC[-11]+RC[-14]*(TRAVERSALCHAINAGE!RC[-4]-TRAVERSALCHAINAGE!RC[-7]) -> 265.30287309481434 | Q12: =RC[-2]+0.14 -> 265.42721397853842 | R12: =RC[-3]+0.284 -> 265.57121397853842 | S12: =RC[-7]+0.14 -> 265.31412459670355 | T12: =RC[-16]+0.178 -> 265.47472349750007 | U12: =AXISDATUMLEVELS!RC[-18] -> 266.96953000000002 | V12: =RC[-1]+0.025*(TRAVERSALCHAINAGE!RC[-17]-TRAVERSALCHAINAGE!RC[-18]) -> 267.00255080215032 | W12: =RC[-2]-0.025*(TRAVERSALCHAINAGE!RC[-17]-TRAVERSALCHAINAGE!RC[-18]) -> 266.94629803534536 | X12: =RC[-1]+0.00625 -> 266.95254803534539 | Y12: =RC[-1]+0.2 -> 267.15254803534538 | Z12: =RC[-1] -> 267.15254803534538 | AA12: 270.64999999999998 | AB12: 270.64999999999998 | AC12: 270.64999999999998 | AD12: 270.64999999999998
A13: P9.5 | B13: 1.1399100000000001E-2 | C13: =AXISDATUMLEVELS!RC[-1]:R[13]C[-1] -> 265.45660000000004 | D13: =RC[-1]-RC[-2]*(TRAVERSALCHAINAGE!RC[6]-TRAVERSALCHAINAGE!RC[5]) -> 265.41955296570279 | E13: =RC[-1]-0.14 -> 265.27955296570281 | F13: =RC[-1]-1 -> 264.27955296570281 | G13: =RC[-1]+RC[-5]*TRAVERSALCHAINAGE!RC[2] -> 264.33542245104991 | H13: =RC[-1]+0.985 -> 265.32042245104992 | I13: =RC[-4]+RC[-7]*(TRAVERSALCHAINAGE!RC-TRAVERSALCHAINAGE!RC[-6]) -> 265.33314070020742 | J13: =RC[-5]+RC[-8]*(TRAVERSALCHAINAGE!RC[-1]-TRAVERSALCHAINAGE!RC[-6]) -> 265.32288365431026 | K13: =RC[-6]+RC[-9]*(TRAVERSALCHAINAGE!RC[-2]-TRAVERSALCHAINAGE!RC[-4]) -> 265.29438560114596 | L13: =RC[-7]+RC[-10]*(TRAVERSALCHAINAGE!RC[-3]-TRAVERSALCHAINAGE!RC[-4]) -> 265.29096593912141 | M13: =RC[-7]+RC[-11]*(TRAVERSALCHAINAGE!RC-TRAVERSALCHAINAGE!RC[-4]) -> 264.3779492234666 | N13: =RC[-1]+0.985 -> 265.36294922346661 | O13: =RC[-10]+RC[-13]*(TRAVERSALCHAINAGE!RC[-4]-TRAVERSALCHAINAGE!RC[-6]) -> 265.36540176041166 | P13: =RC[-11]+RC[-14]*(TRAVERSALCHAINAGE!RC[-4]-TRAVERSALCHAINAGE!RC[-7]) -> 265.37566781447856 | Q13: =RC[-2]+0.14 -> 265.50540176041164 | R13: =RC[-3]+0.284 -> 265.64940176041165 | S13: =RC[-7]+0.14 -> 265.43096593912139 | T13: =RC[-16]+0.178 -> 265.59755296570279 | U13: =AXISDATUMLEVELS!RC[-18] -> 267.12488999999999 | V13: =RC[-1]+0.025*(TRAVERSALCHAINAGE!RC[-17]-TRAVERSALCHAINAGE!RC[-18]) -> 267.15829757902407 | W13: =RC[-2]-0.025*(TRAVERSALCHAINAGE!RC[-17]-TRAVERSALCHAINAGE!RC[-18]) -> 267.10204757910185 | X13: =RC[-1]+0.00625 -> 267.10829757910187 | Y13: =RC[-1]+0.2 -> 267.30829757910186 | Z13: =RC[-1] -> 267.30829757910186 | AA13: 270.64999999999998 | AB13: 270.64999999999998 | AC13: 270.64999999999998 | AD13: 270.64999999999998
A14: P9.6 | B14: 5.3988999999999999E-3 | C14: =AXISDATUMLEVELS!RC[-1]:R[13]C[-1] -> 265.58080000000001 | D14: =RC[-1]-RC[-2]*(TRAVERSALCHAINAGE!RC[6]-TRAVERSALCHAINAGE!RC[5]) -> 265.56325360271575 | E14: =RC[-1]-0.14 -> 265.42325360271576 | F14: =RC[-1]-1 -> 264.42325360271576 | G14: =RC[-1]+RC[-5]*TRAVERSALCHAINAGE!RC[2] -> 264.4497135486655 | H14: =RC[-1]+0.985 -> 265.43471354866551 | I14: =RC[-4]+RC[-7]*(TRAVERSALCHAINAGE!RC-TRAVERSALCHAINAGE!RC[-6]) -> 265.44863204441202 | J14: =RC[-5]+RC[-8]*(TRAVERSALCHAINAGE!RC[-1]-TRAVERSALCHAINAGE!RC[-6]) -> 265.44377608523479 | K14: =RC[-6]+RC[-9]*(TRAVERSALCHAINAGE!RC[-2]-TRAVERSALCHAINAGE!RC[-4]) -> 265.43027732894762 | L14: =RC[-7]+RC[-10]*(TRAVERSALCHAINAGE!RC[-3]-TRAVERSALCHAINAGE!RC[-4]) -> 265.4286576675392 | M14: =RC[-7]+RC[-11]*(TRAVERSALCHAINAGE!RC-TRAVERSALCHAINAGE!RC[-4]) -> 264.47064078608287 | N14: =RC[-1]+0.985 -> 265.45564078608288 | O14: =RC[-10]+RC[-13]*(TRAVERSALCHAINAGE!RC[-4]-TRAVERSALCHAINAGE!RC[-6]) -> 265.46468034669715 | P14: =RC[-11]+RC[-14]*(TRAVERSALCHAINAGE!RC[-4]-TRAVERSALCHAINAGE!RC[-7]) -> 265.46955695779951 | Q14: =RC[-2]+0.14 -> 265.60468034669714 | R14: =RC[-3]+0.284 -> 265.74868034669714 | S14: =RC[-7]+0.14 -> 265.56865766753918 | T14: =RC[-16]+0.178 -> 265.74125360271574 | U14: =AXISDATUMLEVELS!RC[-18] -> 267.28262000000001 | V14: =RC[-1]+0.025*(TRAVERSALCHAINAGE!RC[-17]-TRAVERSALCHAINAGE!RC[-18]) -> 267.31623068162372 | W14: =RC[-2]-0.025*(TRAVERSALCHAINAGE!RC[-17]-TRAVERSALCHAINAGE!RC[-18]) -> 267.25997417697329 | X14: =RC[-1]+0.00625 -> 267.26622417697331 | Y14: =RC[-1]+0.2 -> 267.4662241769733 | Z14: =RC[-1] -> 267.4662241769733 | AA14: 270.64999999999998 | AB14: 270.64999999999998 | AC14: 270.64999999999998 | AD14: 270.64999999999998
A15: Q0 | B15: 0 | C15: =AXISDATUMLEVELS!RC[-1]:R[13]C[-1] -> 265.71045000000004 | D15: =RC[-1]-RC[-2]*(TRAVERSALCHAINAGE!RC[6]-TRAVERSALCHAINAGE!RC[5]) -> 265.71045000000004 | E15: =RC[-1]-0.14 -> 265.57045000000005 | F15: =RC[-1]-1 -> 264.57045000000005 | G15: =RC[-1]+RC[-5]*TRAVERSALCHAINAGE!RC[2] -> 264.57045000000005 | H15: =RC[-1]+0.985 -> 265.55545000000006 | I15: =RC[-4]+RC[-7]*(TRAVERSALCHAINAGE!RC-TRAVERSALCHAINAGE!RC[-6]) -> 265.57045000000005 | J15: =RC[-5]+RC[-8]*(TRAVERSALCHAINAGE!RC[-1]-TRAVERSALCHAINAGE!RC[-6]) -> 265.57045000000005 | K15: =RC[-6]+RC[-9]*(TRAVERSALCHAINAGE!RC[-2]-TRAVERSALCHAINAGE!RC[-4]) -> 265.57045000000005 | L15: =RC[-7]+RC[-10]*(TRAVERSALCHAINAGE!RC[-3]-TRAVERSALCHAINAGE!RC[-4]) -> 265.57045000000005 | M15: =RC[-7]+RC[-11]*(TRAVERSALCHAINAGE!RC-TRAVERSALCHAINAGE!RC[-4]) -> 264.57045000000005 | N15: =RC[-1]+0.985 -> 265.55545000000006 | O15: =RC[-10]+RC[-13]*(TRAVERSALCHAINAGE!RC[-4]-TRAVERSALCHAINAGE!RC[-6]) -> 265.57045000000005 | P15: =RC[-11]+RC[-14]*(TRAVERSALCHAINAGE!RC[-4]-TRAVERSALCHAINAGE!RC[-7]) -> 265.57045000000005 | Q15: =RC[-2]+0.14 -> 265.71045000000004 | R15: =RC[-3]+0.284 -> 265.85445000000004 | S15: =RC[-7]+0.14 -> 265.71045000000004 | T15: =RC[-16]+0.178 -> 265.88845000000003 | U15: =AXISDATUMLEVELS!RC[-18] -> 267.42773 | V15: =RC[-1]+0.025*(TRAVERSALCHAINAGE!RC[-17]-TRAVERSALCHAINAGE!RC[-18]) -> 267.46087986296442 | W15: =RC[-2]-0.025*(TRAVERSALCHAINAGE!RC[-17]-TRAVERSALCHAINAGE!RC[-18]) -> 267.40457360873091 | X15: =RC[-1]+0.00625 -> 267.41082360873094 | Y15: =RC[-1]+0.2 -> 267.61082360873093 | Z15: =RC[-1] -> 267.61082360873093 | AA15: 270.64999999999998 | AB15: 270.64999999999998 | AC15: 270.64999999999998 | AD15: 270.64999999999998